21:19:41.341327 IP 192.168.0.105.41796 > test1.telnet: Flags [S], seq 1339368029, win 64240, options [mss 1460,sackOK,TS val 1056597113 ecr 0,nop,wscale 7], length 0
E..<Lt@.@.l....i...o.D..O."]...................
>.dy........
21:19:41.341361 IP test1.telnet > 192.168.0.105.41796: Flags [S.], seq 2877464047, ack 1339368030, win 65160, options [mss 1460,sackOK,TS val 3918676489 ecr 1056597113,nop,wscale 7], length 0
E..<..@.@......o...i...D....O."^.....W.........
..B	>.dy....
21:19:41.343067 IP 192.168.0.105.41796 > test1.telnet: Flags [.], ack 1, win 502, options [nop,nop,TS val 1056597113 ecr 3918676489], length 0
E..4Lu@.@.l....i...o.D..O."^...............
>.dy..B	
21:19:41.343974 IP 192.168.0.105.41796 > test1.telnet: Flags [P.], seq 1:25, ack 1, win 502, options [nop,nop,TS val 1056597116 ecr 3918676489], length 24 [telnet DO SUPPRESS GO AHEAD, WILL TERMINAL TYPE, WILL NAWS, WILL TSPEED, WILL LFLOW, WILL LINEMODE, WILL NEW-ENVIRON, DO STATUS [|telnet]
E..LLv@.@.k....i...o.D..O."^........h......
>.d|..B	........... ..!.."..'...
21:19:41.343991 IP test1.telnet > 192.168.0.105.41796: Flags [.], ack 25, win 509, options [nop,nop,TS val 3918676492 ecr 1056597116], length 0
E..4%s@.@..(...o...i...D....O."v.....O.....
..B.>.d|
21:19:41.348480 IP test1.telnet > 192.168.0.105.41796: Flags [P.], seq 1:13, ack 25, win 509, options [nop,nop,TS val 3918676496 ecr 1056597116], length 12 [telnet DO TERMINAL TYPE, DO TSPEED, DO XDISPLOC, DO NEW-ENVIRON [|telnet]
E..@%t@.@......o...i...D....O."v.....[.....
..B.>.d|..... ..#..'
21:19:41.348836 IP 192.168.0.105.41796 > test1.telnet: Flags [.], ack 13, win 502, options [nop,nop,TS val 1056597120 ecr 3918676496], length 0
E..4Lw@.@.l....i...o.D..O."v.........Z.....
>.d...B.
21:19:41.348852 IP test1.telnet > 192.168.0.105.41796: Flags [P.], seq 13:28, ack 25, win 509, options [nop,nop,TS val 3918676497 ecr 1056597120], length 15 [telnet WILL SUPPRESS GO AHEAD, DO NAWS, DO LFLOW, DONT LINEMODE, WILL STATUS [|telnet]
E..C%u@.@......o...i...D....O."v.....^.....
..B.>.d.........!.."...
21:19:41.348989 IP 192.168.0.105.41796 > test1.telnet: Flags [P.], seq 25:28, ack 13, win 502, options [nop,nop,TS val 1056597121 ecr 3918676496], length 3 [telnet WONT XDISPLOC [|telnet]
E..7Lx@.@.l....i...o.D..O."v.........Q.....
>.d...B...#
21:19:41.389819 IP test1.telnet > 192.168.0.105.41796: Flags [.], ack 28, win 509, options [nop,nop,TS val 3918676537 ecr 1056597121], length 0
E..4%v@.@......o...i...D....O."y.....O.....
..B9>.d.
21:19:41.389977 IP 192.168.0.105.41796 > test1.telnet: Flags [.], ack 28, win 502, options [nop,nop,TS val 1056597162 ecr 3918676497], length 0
E..4Ly@.@.l....i...o.D..O."y...............
>.d...B.
21:19:41.389999 IP test1.telnet > 192.168.0.105.41796: Flags [P.], seq 28:46, ack 28, win 509, options [nop,nop,TS val 3918676538 ecr 1056597162], length 18 [telnet SB TSPEED SEND SE, SB NEW-ENVIRON SEND SE, SB TERMINAL TYPE SEND SE [|telnet]
E..F%w@.@......o...i...D....O."y.....a.....
..B:>.d... .....'.........
21:19:41.390182 IP 192.168.0.105.41796 > test1.telnet: Flags [P.], seq 28:37, ack 28, win 502, options [nop,nop,TS val 1056597162 ecr 3918676537], length 9 [telnet SB NAWS IS 0x64 0 0x25 SE [|telnet]
E..=Lz@.@.l....i...o.D..O."y........*......
>.d...B9....d.%..
21:19:41.390200 IP test1.telnet > 192.168.0.105.41796: Flags [.], ack 37, win 509, options [nop,nop,TS val 3918676538 ecr 1056597162], length 0
E..4%x@.@......o...i...D....O."......O.....
..B:>.d.
21:19:41.390410 IP 192.168.0.105.41796 > test1.telnet: Flags [.], ack 46, win 502, options [nop,nop,TS val 1056597162 ecr 3918676538], length 0
E..4L{@.@.l....i...o.D..O."................
>.d...B:
21:19:41.390652 IP 192.168.0.105.41796 > test1.telnet: Flags [P.], seq 37:71, ack 46, win 502, options [nop,nop,TS val 1056597162 ecr 3918676538], length 34 [telnet SB TSPEED IS 0x33 0x38 0x34 0x30 0x30 0x2c 0x33 0x38 0x34 0x30 0x30 SE, SB NEW-ENVIRON IS SE, SB TERMINAL TYPE IS 0x6c 0x69 0x6e 0x75 0x78 SE [|telnet]
E..VL|@.@.k....i...o.D..O."..........4.....
>.d...B:.. .38400,38400....'.......linux..
21:19:41.390668 IP test1.telnet > 192.168.0.105.41796: Flags [.], ack 71, win 509, options [nop,nop,TS val 3918676538 ecr 1056597162], length 0
E..4%y@.@......o...i...D....O."......O.....
..B:>.d.
21:19:41.390997 IP test1.telnet > 192.168.0.105.41796: Flags [P.], seq 46:49, ack 71, win 509, options [nop,nop,TS val 3918676539 ecr 1056597162], length 3 [telnet DO ECHO [|telnet]
E..7%z@.@......o...i...D....O."......R.....
..B;>.d....
21:19:41.391504 IP 192.168.0.105.41796 > test1.telnet: Flags [P.], seq 71:74, ack 49, win 502, options [nop,nop,TS val 1056597163 ecr 3918676539], length 3 [telnet WONT ECHO [|telnet]
E..7L}@.@.l....i...o.D..O.".... ...........
>.d...B;...
21:19:41.391635 IP test1.telnet > 192.168.0.105.41796: Flags [P.], seq 49:52, ack 74, win 509, options [nop,nop,TS val 3918676539 ecr 1056597163], length 3 [telnet WILL ECHO [|telnet]
E..7%{@.@......o...i...D... O."......R.....
..B;>.d....
21:19:41.391987 IP 192.168.0.105.41796 > test1.telnet: Flags [P.], seq 74:77, ack 52, win 502, options [nop,nop,TS val 1056597164 ecr 3918676539], length 3 [telnet DO ECHO [|telnet]
E..7L~@.@.l
...i...o.D..O."....#...........
>.d...B;...
21:19:41.392003 IP test1.telnet > 192.168.0.105.41796: Flags [P.], seq 52:72, ack 77, win 509, options [nop,nop,TS val 3918676540 ecr 1056597164], length 20
E..H%|@.@......o...i...D...#O."......c.....
..B<>.d.Ubuntu 18.04.5 LTS

21:19:41.433868 IP 192.168.0.105.41796 > test1.telnet: Flags [.], ack 72, win 502, options [nop,nop,TS val 1056597205 ecr 3918676540], length 0
E..4L.@.@.l....i...o.D..O."....7.....j.....
>.d...B<
21:19:41.433895 IP test1.telnet > 192.168.0.105.41796: Flags [P.], seq 72:85, ack 77, win 509, options [nop,nop,TS val 3918676582 ecr 1056597205], length 13
E..A%}@.@......o...i...D...7O."......\.....
..Bf>.d.test1 login: 
21:19:41.434473 IP 192.168.0.105.41796 > test1.telnet: Flags [.], ack 85, win 502, options [nop,nop,TS val 1056597206 ecr 3918676582], length 0
E..4L.@.@.l....i...o.D..O."....D.....2.....
>.d...Bf
21:19:42.249314 IP 192.168.0.105.41796 > test1.telnet: Flags [P.], seq 77:78, ack 85, win 502, options [nop,nop,TS val 1056598021 ecr 3918676582], length 1
E..5L.@.@.l	...i...o.D..O."....D....K......
>.h...Bft
21:19:42.249477 IP test1.telnet > 192.168.0.105.41796: Flags [P.], seq 85:86, ack 78, win 509, options [nop,nop,TS val 3918677397 ecr 1056598021], length 1
E..5%~@.@......o...i...D...DO."......P.....
..E.>.h.t
21:19:42.250003 IP 192.168.0.105.41796 > test1.telnet: Flags [.], ack 86, win 502, options [nop,nop,TS val 1056598022 ecr 3918677397], length 0
E..4L.@.@.l	...i...o.D..O."....E...........
>.h...E.
21:19:42.349642 IP 192.168.0.105.41796 > test1.telnet: Flags [P.], seq 78:79, ack 86, win 502, options [nop,nop,TS val 1056598121 ecr 3918677397], length 1
E..5L.@.@.l....i...o.D..O."....E....We.....
>.hi..E.e
21:19:42.349862 IP test1.telnet > 192.168.0.105.41796: Flags [P.], seq 86:87, ack 79, win 509, options [nop,nop,TS val 3918677498 ecr 1056598121], length 1
E..5%.@.@......o...i...D...EO."......P.....
..E.>.hie
21:19:42.350305 IP 192.168.0.105.41796 > test1.telnet: Flags [.], ack 87, win 502, options [nop,nop,TS val 1056598122 ecr 3918677498], length 0
E..4L.@.@.l....i...o.D..O."....F...........
>.hj..E.
21:19:42.533796 IP 192.168.0.105.41796 > test1.telnet: Flags [P.], seq 79:80, ack 87, win 502, options [nop,nop,TS val 1056598305 ecr 3918677498], length 1
E..5L.@.@.l....i...o.D..O."....F....HF.....
>.i!..E.s
21:19:42.533973 IP test1.telnet > 192.168.0.105.41796: Flags [P.], seq 87:88, ack 80, win 509, options [nop,nop,TS val 3918677682 ecr 1056598305], length 1
E..5%.@.@..
...o...i...D...FO."......P.....
..F.>.i!s
21:19:42.534526 IP 192.168.0.105.41796 > test1.telnet: Flags [.], ack 88, win 502, options [nop,nop,TS val 1056598306 ecr 3918677682], length 0
E..4L.@.@.l....i...o.D..O."....G...........
>.i"..F.
21:19:42.648482 IP 192.168.0.105.41796 > test1.telnet: Flags [P.], seq 80:81, ack 88, win 502, options [nop,nop,TS val 1056598420 ecr 3918677682], length 1
E..5L.@.@.l....i...o.D..O."....G....F......
>.i...F.t
21:19:42.648652 IP test1.telnet > 192.168.0.105.41796: Flags [P.], seq 88:89, ack 81, win 509, options [nop,nop,TS val 3918677796 ecr 1056598420], length 1
E..5%.@.@..	...o...i...D...GO."......P.....
..G$>.i.t
21:19:42.649174 IP 192.168.0.105.41796 > test1.telnet: Flags [.], ack 89, win 502, options [nop,nop,TS val 1056598421 ecr 3918677796], length 0
E..4L.@.@.l....i...o.D..O."....H...........
>.i...G$
21:19:42.791926 IP 192.168.0.105.41796 > test1.telnet: Flags [P.], seq 81:82, ack 89, win 502, options [nop,nop,TS val 1056598563 ecr 3918677796], length 1
E..5L.@.@.l....i...o.D..O."....H....T......
>.j#..G$e
21:19:42.792134 IP test1.telnet > 192.168.0.105.41796: Flags [P.], seq 89:90, ack 82, win 509, options [nop,nop,TS val 3918677940 ecr 1056598563], length 1
E..5%.@.@......o...i...D...HO."......P.....
..G.>.j#e
21:19:42.792545 IP 192.168.0.105.41796 > test1.telnet: Flags [.], ack 90, win 502, options [nop,nop,TS val 1056598564 ecr 3918677940], length 0
E..4L.@.@.l....i...o.D..O."....I...........
>.j$..G.
21:19:42.907107 IP 192.168.0.105.41796 > test1.telnet: Flags [P.], seq 82:83, ack 90, win 502, options [nop,nop,TS val 1056598679 ecr 3918677940], length 1
E..5L.@.@.k....i...o.D..O."....I....F......
>.j...G.r
21:19:42.907262 IP test1.telnet > 192.168.0.105.41796: Flags [P.], seq 90:91, ack 83, win 509, options [nop,nop,TS val 3918678055 ecr 1056598679], length 1
E..5%.@.@......o...i...D...IO."......P.....
..H'>.j.r
21:19:42.907820 IP 192.168.0.105.41796 > test1.telnet: Flags [.], ack 91, win 502, options [nop,nop,TS val 1056598679 ecr 3918678055], length 0
E..4L.@.@.k....i...o.D..O."....J...........
>.j...H'
21:19:44.431113 IP 192.168.0.105.41796 > test1.telnet: Flags [P.], seq 83:85, ack 91, win 502, options [nop,nop,TS val 1056600203 ecr 3918678055], length 2
E..6L.@.@.k....i...o.D..O."....J...........
>.p...H'.
21:19:44.431249 IP test1.telnet > 192.168.0.105.41796: Flags [P.], seq 91:93, ack 85, win 509, options [nop,nop,TS val 3918679579 ecr 1056600203], length 2
E..6%.@.@......o...i...D...JO."......Q.....
..N.>.p.

21:19:44.431684 IP 192.168.0.105.41796 > test1.telnet: Flags [.], ack 93, win 502, options [nop,nop,TS val 1056600203 ecr 3918679579], length 0
E..4L.@.@.k....i...o.D..O."....L...........
>.p...N.
21:19:44.432467 IP test1.telnet > 192.168.0.105.41796: Flags [P.], seq 93:103, ack 85, win 509, options [nop,nop,TS val 3918679580 ecr 1056600203], length 10
E..>%.@.@......o...i...D...LO."......Y.....
..N.>.p.Password: 
21:19:44.432862 IP 192.168.0.105.41796 > test1.telnet: Flags [.], ack 103, win 502, options [nop,nop,TS val 1056600204 ecr 3918679580], length 0
E..4L.@.@.k....i...o.D..O."....V...........
>.p...N.
21:19:45.865027 IP 192.168.0.105.41796 > test1.telnet: Flags [P.], seq 85:86, ack 103, win 502, options [nop,nop,TS val 1056601637 ecr 3918679580], length 1
E..5L.@.@.k....i...o.D..O."....V....6
.....
>.v%..N.p
21:19:45.906777 IP test1.telnet > 192.168.0.105.41796: Flags [.], ack 86, win 509, options [nop,nop,TS val 3918681054 ecr 1056601637], length 0
E..4%.@.@......o...i...D...VO."......O.....
..S.>.v%
21:19:46.022544 IP 192.168.0.105.41796 > test1.telnet: Flags [P.], seq 86:87, ack 103, win 502, options [nop,nop,TS val 1056601794 ecr 3918681054], length 1
E..5L.@.@.k....i...o.D..O."....V....>......
>.v...S.a
21:19:46.022610 IP test1.telnet > 192.168.0.105.41796: Flags [.], ack 87, win 509, options [nop,nop,TS val 3918681170 ecr 1056601794], length 0
E..4%.@.@......o...i...D...VO."......O.....
..TR>.v.
21:19:46.269858 IP 192.168.0.105.41796 > test1.telnet: Flags [P.], seq 87:88, ack 103, win 502, options [nop,nop,TS val 1056602041 ecr 3918681170], length 1
E..5L.@.@.k....i...o.D..O."....V....+>.....
>.w...TRs
21:19:46.269876 IP test1.telnet > 192.168.0.105.41796: Flags [.], ack 88, win 509, options [nop,nop,TS val 3918681417 ecr 1056602041], length 0
E..4%.@.@......o...i...D...VO."......O.....
..UI>.w.
21:19:46.356225 IP 192.168.0.105.41796 > test1.telnet: Flags [P.], seq 88:89, ack 103, win 502, options [nop,nop,TS val 1056602128 ecr 3918681417], length 1
E..5L.@.@.k....i...o.D..O."....V....)......
>.x...UIs
21:19:46.356252 IP test1.telnet > 192.168.0.105.41796: Flags [.], ack 89, win 509, options [nop,nop,TS val 3918681504 ecr 1056602128], length 0
E..4%.@.@......o...i...D...VO."......O.....
..U.>.x.
21:19:46.783193 IP 192.168.0.105.41796 > test1.telnet: Flags [P.], seq 89:91, ack 103, win 502, options [nop,nop,TS val 1056602555 ecr 3918681504], length 2
E..6L.@.@.k....i...o.D..O."....V...........
>.y...U..
21:19:46.783216 IP test1.telnet > 192.168.0.105.41796: Flags [.], ack 91, win 509, options [nop,nop,TS val 3918681931 ecr 1056602555], length 0
E..4%.@.@......o...i...D...VO."......O.....
..WK>.y.
21:19:46.783467 IP test1.telnet > 192.168.0.105.41796: Flags [P.], seq 103:105, ack 91, win 509, options [nop,nop,TS val 3918681931 ecr 1056602555], length 2
E..6%.@.@......o...i...D...VO."......Q.....
..WK>.y.

21:19:46.783878 IP 192.168.0.105.41796 > test1.telnet: Flags [.], ack 105, win 502, options [nop,nop,TS val 1056602556 ecr 3918681931], length 0
E..4L.@.@.k....i...o.D..O."....X.....E.....
>.y...WK
21:19:46.794609 IP test1.telnet > 192.168.0.105.41796: Flags [P.], seq 105:173, ack 91, win 509, options [nop,nop,TS val 3918681942 ecr 1056602556], length 68
E..x%.@.@......o...i...D...XO."............
..WV>.y.Last login: Tue Feb  2 21:17:08 UTC 2021 from 192.168.0.105 on pts/1
21:19:46.795059 IP 192.168.0.105.41796 > test1.telnet: Flags [.], ack 173, win 502, options [nop,nop,TS val 1056602567 ecr 3918681942], length 0
E..4L.@.@.k....i...o.D..O."................
>.y...WV
21:19:46.795072 IP test1.telnet > 192.168.0.105.41796: Flags [P.], seq 173:175, ack 91, win 509, options [nop,nop,TS val 3918681943 ecr 1056602567], length 2
E..6%.@.@......o...i...D....O."......Q.....
..WW>.y.

21:19:46.795461 IP 192.168.0.105.41796 > test1.telnet: Flags [.], ack 175, win 502, options [nop,nop,TS val 1056602567 ecr 3918681943], length 0
E..4L.@.@.k....i...o.D..O."................
>.y...WW
21:19:47.168774 IP test1.telnet > 192.168.0.105.41796: Flags [P.], seq 175:242, ack 91, win 509, options [nop,nop,TS val 3918682316 ecr 1056602567], length 67
E..w%.@.@......o...i...D....O."............
..X.>.y.Welcome to Ubuntu 18.04.5 LTS (GNU/Linux 4.15.0-135-generic x86_64)
21:19:47.169151 IP 192.168.0.105.41796 > test1.telnet: Flags [.], ack 242, win 502, options [nop,nop,TS val 1056602941 ecr 3918682316], length 0
E..4L.@.@.k....i...o.D..O."................
>.{=..X.
21:19:47.169174 IP test1.telnet > 192.168.0.105.41796: Flags [P.], seq 242:1007, ack 91, win 509, options [nop,nop,TS val 3918682317 ecr 1056602941], length 765
E..1%.@.@......o...i...D....O."......L.....
..X.>.{=

 * Documentation:  https://help.ubuntu.com
 * Management:     https://landscape.canonical.com
 * Support:        https://ubuntu.com/advantage

  System information as of Tue Feb  2 21:19:46 UTC 2021

  System load:  0.0               Processes:             93
  Usage of /:   43.2% of 9.78GB   Users logged in:       1
  Memory usage: 15%               IP address for enp0s3: 192.168.0.111
  Swap usage:   0%

 * Introducing self-healing high availability clusters in MicroK8s.
   Simple, hardened, Kubernetes for production, from RaspberryPi to DC.

     https://microk8s.io/high-availability

40 packages can be updated.
0 updates are security updates.

New release '20.04.1 LTS' available.
Run 'do-release-upgrade' to upgrade to it.



21:19:47.169408 IP 192.168.0.105.41796 > test1.telnet: Flags [.], ack 1007, win 501, options [nop,nop,TS val 1056602941 ecr 3918682317], length 0
E..4L.@.@.k....i...o.D..O."................
>.{=..X.
21:19:47.234083 IP test1.telnet > 192.168.0.105.41796: Flags [P.], seq 1007:1023, ack 91, win 509, options [nop,nop,TS val 3918682382 ecr 1056602941], length 16
E..D%.@.@......o...i...D....O."......_.....
..Y.>.{=tester@test1:~$ 
21:19:47.234465 IP 192.168.0.105.41796 > test1.telnet: Flags [.], ack 1023, win 501, options [nop,nop,TS val 1056603006 ecr 3918682382], length 0
E..4L.@.@.k....i...o.D..O."..........+.....
>.{~..Y.

